{
  "artifact_id": "artifact:sha256:4444444444444444444444444444444444444444444444444444444444444444",
  "artifact_type": "RoleResult",
  "schema_version": "1.0.0",
  "protocol_version": "1.0.0",
  "producer": {
    "primitive": "role",
    "name": "architect.role",
    "version": "1.0.0",
    "invocation_id": "role-call-003"
  },
  "created_at": "2026-05-23T20:04:00.000Z",
  "source_refs": [],
  "output_refs": [],
  "ownership": {
    "owns_files": [],
    "owns_interfaces": [],
    "owns_data": [],
    "owns_workflow_steps": []
  },
  "confidence": {
    "score": 0.35,
    "level": "low",
    "reason_codes": ["fixture:blocked"]
  },
  "review_required": {
    "required": true,
    "reason_codes": ["role:blocked"]
  },
  "diagnostics": {
    "status": "blocked",
    "warnings": [],
    "errors": [
      {
        "code": "context:missing_architecture_decision",
        "severity": "blocker"
      }
    ],
    "missing_context": [
      {
        "code": "architecture_decision",
        "ref_type": "artifact",
        "id": "adr:storage-contract"
      }
    ]
  },
  "payload": {
    "invocation_id": "role-call-003",
    "role_id": "architect.role",
    "role_version": "1.0.0",
    "status": "blocked",
    "confidence": {
      "score": 0.35,
      "level": "low",
      "reason_codes": ["fixture:blocked"]
    },
    "missing_context": [
      {
        "code": "architecture_decision",
        "ref_type": "artifact",
        "id": "adr:storage-contract"
      }
    ],
    "human_review_required": true,
    "source_artifacts": [],
    "output_artifacts": [],
    "decision_verdict": {
      "type": "decision",
      "suggested_choice": null,
      "suggested_response": "Blocked until the storage contract decision is available.",
      "confidence": 4,
      "risk": 10,
      "block_trigger": true
    },
    "retry_recommendation": {
      "recommended": true,
      "reason_codes": ["context:missing_architecture_decision"]
    },
    "trace": {
      "trace_refs": [
        {
          "ref_type": "file",
          "id": "traces/roles/role-call-003.jsonl",
          "relation": "produces"
        }
      ]
    }
  }
}
