{
  "artifact_id": "artifact:sha256:032677b562fac25d8c5978af70ab41744b42046e78047c8fa9bba60da7898f2d",
  "artifact_type": "DecisionRecord",
  "schema_version": "1.0.0",
  "protocol_version": "1.0.0",
  "producer": {
    "primitive": "loop",
    "name": "daimyo",
    "version": "0.12.0",
    "invocation_id": "dgos-t-0020-fixture-capture"
  },
  "created_at": "2026-05-23T21:00:00.000Z",
  "source_refs": [
    {
      "ref_type": "task",
      "id": "task-protocol-fixture-capture",
      "relation": "read"
    }
  ],
  "output_refs": [],
  "ownership": {
    "owns_files": [],
    "owns_interfaces": [],
    "owns_data": [],
    "owns_workflow_steps": []
  },
  "confidence": {
    "score": 1,
    "level": "high"
  },
  "review_required": {
    "required": false,
    "reason_codes": []
  },
  "diagnostics": {
    "status": "produced",
    "warnings": [],
    "errors": [],
    "missing_context": []
  },
  "payload": {
    "decision_id": "decision-protocol-fixture-capture",
    "request": {
      "decision_id": "decision-protocol-fixture-capture",
      "node_id": "node-protocol-fixture-capture",
      "task_id": "task-protocol-fixture-capture",
      "surface": "routing",
      "prompt": "Should the protocol fixture corpus include daimyo-captured artifacts?",
      "context": {
        "task": "DGOS-T-0020",
        "source": "daimyo test helper"
      },
      "options": ["capture-runtime-artifacts", "hand-write-only"]
    },
    "verdict": {
      "type": "decision",
      "suggested_choice": "capture-runtime-artifacts",
      "suggested_response": "Capture artifacts emitted by daimyo helpers and keep them as valid fixtures.",
      "confidence": 9,
      "risk": 2,
      "block_trigger": false
    },
    "tier": 1,
    "rationale": "Captured from daimyo makeDecisionRecord during DGOS-T-0020 fixture generation."
  }
}
