{
  "artifact_id": "artifact:sha256:2222222222222222222222222222222222222222222222222222222222222222",
  "artifact_type": "RoleResult",
  "schema_version": "1.0.0",
  "protocol_version": "1.0.0",
  "producer": {
    "primitive": "role",
    "name": "decision.role",
    "version": "1.0.0",
    "invocation_id": "role-call-001"
  },
  "created_at": "2026-05-23T20:02:00.000Z",
  "source_refs": [
    {
      "ref_type": "artifact",
      "id": "artifact:sha256:1111111111111111111111111111111111111111111111111111111111111111",
      "artifact_type": "RoleInvocation",
      "schema_version": "1.0.0",
      "protocol_version": "1.0.0",
      "relation": "derived_from"
    }
  ],
  "output_refs": [
    {
      "ref_type": "artifact",
      "id": "artifact:sha256:eeeeeeeeeeeeeeeeeeeeeeeeeeeeeeeeeeeeeeeeeeeeeeeeeeeeeeeeeeeeeeee",
      "artifact_type": "DecisionRecord",
      "schema_version": "1.0.0",
      "protocol_version": "1.0.0",
      "relation": "produces"
    }
  ],
  "ownership": {
    "owns_files": [],
    "owns_interfaces": ["interface:protocol-role-result"],
    "owns_data": [],
    "owns_workflow_steps": ["workflow:role-result"]
  },
  "confidence": {
    "score": 0.9,
    "level": "high",
    "reason_codes": ["fixture:produced"]
  },
  "review_required": {
    "required": false,
    "reason_codes": []
  },
  "diagnostics": {
    "status": "produced",
    "warnings": [],
    "errors": [],
    "missing_context": []
  },
  "payload": {
    "invocation_id": "role-call-001",
    "role_id": "decision.role",
    "role_version": "1.0.0",
    "status": "produced",
    "confidence": {
      "score": 0.9,
      "level": "high",
      "reason_codes": ["fixture:produced"]
    },
    "missing_context": [],
    "human_review_required": false,
    "source_artifacts": [
      {
        "ref_type": "artifact",
        "id": "artifact:sha256:aaaaaaaaaaaaaaaaaaaaaaaaaaaaaaaaaaaaaaaaaaaaaaaaaaaaaaaaaaaaaaaa",
        "artifact_type": "DecisionRequest",
        "schema_version": "1.0.0",
        "protocol_version": "1.0.0",
        "relation": "read"
      }
    ],
    "output_artifacts": [
      {
        "ref_type": "artifact",
        "id": "artifact:sha256:eeeeeeeeeeeeeeeeeeeeeeeeeeeeeeeeeeeeeeeeeeeeeeeeeeeeeeeeeeeeeeee",
        "artifact_type": "DecisionRecord",
        "schema_version": "1.0.0",
        "protocol_version": "1.0.0",
        "relation": "produces"
      }
    ],
    "decision_verdict": {
      "type": "decision",
      "suggested_choice": "continue",
      "suggested_response": "Continue with the bounded protocol schema change.",
      "confidence": 9,
      "risk": 3,
      "block_trigger": false
    },
    "usage": {
      "estimated_cost_usd": 0.03,
      "input_tokens": 4200,
      "output_tokens": 700,
      "model_id": "standard-fixture"
    },
    "retry_recommendation": {
      "recommended": false,
      "reason_codes": []
    },
    "trace": {
      "trace_refs": [
        {
          "ref_type": "file",
          "id": "traces/roles/role-call-001.jsonl",
          "relation": "produces"
        }
      ],
      "trace_id": "trace-role-call-001"
    }
  }
}
